<?xml version="1.0" encoding="UTF-8"?>

<xs:schema xmlns:xs="http://www.w3.org/2001/XMLSchema">

    <xs:element name="feedbacks">

        <xs:complexType>

            <xs:sequence>

                <xs:element name="feedback" maxOccurs="unbounded">

                    <xs:complexType>

                        <xs:sequence>

                            <xs:element name="id" type="xs:integer"/>

                            <xs:element name="name" type="xs:string"/>

                            <xs:element name="email" type="xs:string"/>

                            <xs:element name="rating">

                                <xs:simpleType>

                                    <xs:restriction base="xs:integer">

                                        <xs:minInclusive value="1"/>

                                        <xs:maxInclusive value="5"/>

                                    </xs:restriction>

                                </xs:simpleType>

                            </xs:element>

                            <xs:element name="category" type="xs:string"/>

                            <xs:element name="comment" type="xs:string"/>

                        </xs:sequence>

                    </xs:complexType>

                </xs:element>

            </xs:sequence>

        </xs:complexType>

    </xs:element>

</xs:schema>